{
  "$schema": "http://json-schema.org/draft-07/schema#",
  "title": "Alatyr optional module catalog",
  "type": "object",
  "required": ["schema_version", "capability_kind", "surfaces", "modules"],
  "properties": {
    "schema_version": {"const": 1},
    "capability_kind": {"const": "alatyr-optional-module-catalog"},
    "surfaces": {
      "type": "object",
      "minProperties": 1,
      "propertyNames": {"pattern": "^\\.ai/"},
      "additionalProperties": {"$ref": "#/definitions/sharedSurface"}
    },
    "modules": {
      "type": "object",
      "minProperties": 1,
      "additionalProperties": {"$ref": "#/definitions/module"}
    }
  },
  "definitions": {
    "stringArray": {
      "type": "array",
      "items": {"type": "string", "minLength": 1},
      "uniqueItems": true
    },
    "sharedSurface": {
      "type": "object",
      "required": [
        "ownership",
        "producers",
        "merge_strategy",
        "preserve_on_disable"
      ],
      "properties": {
        "ownership": {"const": "target-adapter-shared"},
        "producers": {
          "$ref": "#/definitions/stringArray",
          "minItems": 2
        },
        "merge_strategy": {
          "enum": [
            "record-merge-by-assistant-id",
            "target-owned-section-merge"
          ]
        },
        "preserve_on_disable": {"type": "boolean"}
      },
      "additionalProperties": false
    },
    "module": {
      "type": "object",
      "required": ["module_kind", "min_framework_pack", "requires", "rule_ids", "framework_files", "target_files", "check_ids"],
      "properties": {
        "module_kind": {
          "enum": [
            "project-facing",
            "assistant-infrastructure",
            "governance-support",
            "source-repository"
          ]
        },
        "min_framework_pack": {"enum": ["kernel", "core", "standard", "complete"]},
        "requires": {"$ref": "#/definitions/stringArray"},
        "operation_ids": {"$ref": "#/definitions/stringArray"},
        "rule_ids": {"$ref": "#/definitions/stringArray"},
        "framework_files": {"$ref": "#/definitions/stringArray"},
        "target_files": {"$ref": "#/definitions/stringArray"},
        "change_path_prefixes": {"$ref": "#/definitions/stringArray"},
        "check_ids": {"$ref": "#/definitions/stringArray", "minItems": 1}
      },
      "additionalProperties": false
    }
  },
  "additionalProperties": false
}
