{
  "schema_version": 1,
  "capability_kind": "alatyr-optional-module-catalog",
  "surfaces": {
    ".ai/assistant/assistant-capabilities.json": {
      "ownership": "target-adapter-shared",
      "producers": [
        "assistant-runtime-capabilities",
        "diagrams",
        "multi-assistant-bridges",
        "subagent-delegation"
      ],
      "merge_strategy": "record-merge-by-assistant-id",
      "preserve_on_disable": true
    },
    ".ai/assistant/bridge-capability-matrix.md": {
      "ownership": "target-adapter-shared",
      "producers": [
        "assistant-runtime-capabilities",
        "ai-infrastructure",
        "diagrams",
        "multi-assistant-bridges",
        "subagent-delegation"
      ],
      "merge_strategy": "target-owned-section-merge",
      "preserve_on_disable": true
    }
  },
  "modules": {
    "blueprint-change": {
      "module_kind": "project-facing",
      "min_framework_pack": "standard",
      "requires": ["installed-operations"],
      "operation_ids": ["create-project-blueprint", "product-change"],
      "rule_ids": ["ALATYR-CHANGE-001"],
      "framework_files": ["blueprint-driven-change.md"],
      "target_files": [
        ".ai/assistant/flows/blueprint-driven-change.flow.md",
        ".ai/assistant/flows/project-blueprint-creation.flow.md"
      ],
      "check_ids": ["operation-contracts"]
    },
    "consistency-map": {
      "module_kind": "project-facing",
      "min_framework_pack": "complete",
      "requires": [],
      "rule_ids": ["ALATYR-INTEGRITY-001", "ALATYR-SOURCE-001"],
      "framework_files": ["logical-integrity.md", "source-of-truth-registry.md"],
      "target_files": [
        ".ai/project/source-of-truth-registry.md",
        ".ai/project/consistency-map.json",
        ".ai/project/consistency/areas/_template.json",
        ".ai/project/consistency/relationship-candidates.json",
        ".ai/assistant/consistency-reverse-index.json",
        ".ai/assistant/context/consistency-routing.json",
        ".ai/assistant/context/cost-scenarios.json"
      ],
      "check_ids": ["consistency-map", "source-of-truth-registry"]
    },
    "architecture-knowledge": {
      "module_kind": "project-facing",
      "min_framework_pack": "complete",
      "requires": ["installed-operations"],
      "operation_ids": ["architecture-assistance"],
      "rule_ids": ["ALATYR-ARCHITECTURE-001"],
      "framework_files": ["architecture-knowledge.md"],
      "target_files": [
        ".ai/project/architecture/README.md",
        ".ai/project/architecture/catalog.json",
        ".ai/assistant/context/intents/architecture-request.json",
        ".ai/assistant/flows/architecture-assistance.flow.md",
        ".ai/assistant/templates/architecture-pattern.md",
        ".ai/assistant/templates/architecture-area.md",
        ".ai/assistant/templates/architecture-discussion-result.md"
      ],
      "check_ids": ["architecture-knowledge"]
    },
    "code-documentation": {
      "module_kind": "project-facing",
      "min_framework_pack": "complete",
      "requires": ["installed-operations"],
      "rule_ids": ["ALATYR-CODEDOC-001"],
      "framework_files": ["code-documentation.md"],
      "target_files": [
        ".ai/project/documentation/README.md",
        ".ai/project/documentation/catalog.json",
        ".ai/project/documentation/profiles.json",
        ".ai/assistant/context/intents/code-documentation.json",
        ".ai/assistant/flows/documentation-sync.flow.md",
        ".ai/assistant/templates/code-documentation-profile-review.md",
        ".ai/assistant/skills/code-documentation/SKILL.md"
      ],
      "check_ids": ["code-documentation"]
    },
    "project-vocabulary": {
      "module_kind": "project-facing",
      "min_framework_pack": "complete",
      "requires": ["installed-operations"],
      "operation_ids": ["project-vocabulary"],
      "rule_ids": ["ALATYR-VOCABULARY-001"],
      "framework_files": ["project-vocabulary.md"],
      "target_files": [
        ".ai/project/vocabulary/README.md",
        ".ai/project/vocabulary/catalog.json",
        ".ai/project/vocabulary/terms.json",
        ".ai/project/vocabulary/data-dictionary-links.json",
        ".ai/assistant/context/intents/vocabulary-request.json",
        ".ai/assistant/flows/project-vocabulary.flow.md",
        ".ai/assistant/templates/vocabulary-term-review.md",
        ".ai/assistant/skills/project-vocabulary/SKILL.md"
      ],
      "check_ids": ["project-vocabulary"]
    },
    "test-first-development": {
      "module_kind": "project-facing",
      "min_framework_pack": "complete",
      "requires": ["installed-operations"],
      "operation_ids": ["test-first-change"],
      "rule_ids": ["ALATYR-TDD-001"],
      "framework_files": ["test-first-development.md"],
      "target_files": [
        ".ai/project/testing/README.md",
        ".ai/project/testing/test-first-policy.json",
        ".ai/assistant/context/intents/test-first-request.json",
        ".ai/assistant/flows/test-first-configuration.flow.md",
        ".ai/assistant/flows/test-first-change.flow.md",
        ".ai/assistant/gates/test-first-development.md",
        ".ai/assistant/templates/test-first-evidence.md",
        ".ai/assistant/skills/test-first-development/SKILL.md",
        ".ai/assistant/templates/test-execution-evidence.json"
      ],
      "check_ids": ["test-first-development"]
    },
    "extensions": {
      "module_kind": "assistant-infrastructure",
      "min_framework_pack": "complete",
      "requires": ["ai-infrastructure"],
      "rule_ids": ["ALATYR-EXTENSION-001", "ALATYR-SAFETY-002"],
      "framework_files": ["extensions.md", "prompt-injection.md"],
      "target_files": [
        ".ai/assistant/extensions/README.md",
        ".ai/assistant/extensions/catalog.json",
        ".ai/assistant/extensions/lock.json",
        ".ai/assistant/context/intents/extension-request.json",
        ".ai/assistant/flows/extension-lifecycle.flow.md",
        ".ai/assistant/gates/extensions.md",
        ".ai/assistant/templates/extension-review.md",
        ".ai/assistant/templates/extension-lifecycle-record.md"
      ],
      "check_ids": ["extensions"]
    },
    "dependency-knowledge": {
      "module_kind": "project-facing",
      "min_framework_pack": "complete",
      "requires": ["installed-operations"],
      "operation_ids": ["dependency-knowledge"],
      "rule_ids": ["ALATYR-DEPENDENCY-001", "ALATYR-SAFETY-002", "ALATYR-SOURCE-001"],
      "framework_files": ["dependency-knowledge.md", "prompt-injection.md", "source-of-truth-registry.md"],
      "target_files": [
        ".ai/project/dependencies/README.md",
        ".ai/project/dependencies/policy.json",
        ".ai/project/dependencies/catalog.json",
        ".ai/project/dependencies/knowledge-lock.json",
        ".ai/project/dependencies/deviations.json",
        ".ai/project/dependencies/snapshots/README.md",
        ".ai/assistant/context/intents/dependency-knowledge-request.json",
        ".ai/assistant/flows/dependency-knowledge-sync.flow.md",
        ".ai/assistant/gates/dependency-knowledge.md",
        ".ai/assistant/templates/dependency-knowledge-sync-report.md"
      ],
      "check_ids": ["dependency-knowledge"]
    },
    "workspace-modes": {
      "module_kind": "project-facing",
      "min_framework_pack": "complete",
      "requires": ["installed-operations"],
      "operation_ids": ["workspace-mode"],
      "rule_ids": ["ALATYR-MODE-001", "ALATYR-CONTEXT-001", "ALATYR-SOURCE-001"],
      "framework_files": ["workspace-modes.md", "context-router.md", "source-of-truth-registry.md"],
      "target_files": [
        ".ai/project/workspace-modes/README.md",
        ".ai/project/workspace-modes/catalog.json",
        ".ai/project/workspace-modes/root/README.md",
        ".ai/project/workspace-modes/root/context.json",
        ".ai/project/workspace-modes/modes/_template/README.md",
        ".ai/project/workspace-modes/modes/_template/mode.json",
        ".ai/assistant/context/intents/workspace-mode-request.json",
        ".ai/assistant/flows/workspace-mode.flow.md",
        ".ai/assistant/gates/workspace-mode.md",
        ".ai/assistant/templates/workspace-mode-suggestion.md",
        ".ai/assistant/templates/workspace-mode-preflight.md"
      ],
      "check_ids": ["workspace-modes"]
    },
    "diagrams": {
      "module_kind": "project-facing",
      "min_framework_pack": "complete",
      "requires": ["assistant-runtime-capabilities", "installed-operations"],
      "operation_ids": ["diagram-discussion"],
      "rule_ids": ["ALATYR-DIAGRAM-001"],
      "framework_files": ["diagram-guidance.md", "ascii-diagrams.md"],
      "target_files": [
        ".ai/assistant/context/intents/diagram-request.json",
        ".ai/assistant/flows/diagram-discussion.flow.md",
        ".ai/assistant/gates/visual-validation.md",
        ".ai/assistant/templates/diagram-presentation.md",
        ".ai/assistant/templates/ascii-diagram.md",
        ".ai/assistant/templates/visual-validation-review.md",
        ".ai/assistant/assistant-capabilities.json",
        ".ai/assistant/bridge-capability-matrix.md"
      ],
      "check_ids": ["discussion-diagrams", "assistant-capability-index"]
    },
    "assistant-runtime-capabilities": {
      "module_kind": "assistant-infrastructure",
      "min_framework_pack": "core",
      "requires": [],
      "rule_ids": ["ALATYR-BRIDGE-001"],
      "framework_files": ["bridge-capability-matrix.md"],
      "target_files": [
        ".ai/assistant/assistant-capabilities.json",
        ".ai/assistant/bridge-capability-matrix.md"
      ],
      "check_ids": ["assistant-capability-index", "bridge-capability-matrix"]
    },
    "ai-infrastructure": {
      "module_kind": "assistant-infrastructure",
      "min_framework_pack": "core",
      "requires": ["assistant-runtime-capabilities", "installed-operations"],
      "operation_ids": ["ai-infrastructure-inventory", "ai-infrastructure-recommendation", "skill-adaptation"],